,Row Names,pclass,Name,Age,Embarked,Current Home Destination,Room,Ticket #,Boat #,Gender,Had Chronic Illness (Y/N),Birth Town,Birth Town,Survived (Y/N)
0,1,1st,"Allen, Miss Elisabeth Walton",29,Southampton,"St Louis, MO",B-5,24160 L221,2,female,N,SANTA MONICA,UNITED STATES,Y
1,2,1st,"Allison, Miss Helen Loraine",2,Southampton,"Montreal, PQ / Chesterville, ON",C26,,,female,Y,VANCOUVER,BRITISH COLUMBIA,N
2,3,1st,"Allison, Mr Hudson Joshua Creighton",30,Southampton,"Montreal, PQ / Chesterville, ON",C26,,-135,male,Y,LONDON,UNITED KINGDOM,N
3,4,1st,"Allison, Mrs Hudson J.C. (Bessie Waldo Daniels)",25,Southampton,"Montreal, PQ / Chesterville, ON",C26,,,female,Y,BEIJING,CHINA,N
4,5,1st,"Allison, Master Hudson Trevor",0.9167,Southampton,"Montreal, PQ / Chesterville, ON",C22,,11,male,Y,,,Y
5,6,1st,"Anderson, Mr Harry",47,Southampton,"New York, NY",E-12,,3,male,N,,,Y
6,7,1st,"Andrews, Miss Kornelia Theodosia",63,Southampton,"Hudson, NY",D-7,13502 L77,10,female,Y,HONOLULU,HAWAII,Y
7,8,1st,"Andrews, Mr Thomas, jr",39,Southampton,"Belfast, NI",A-36,,,male,Y,LONDON,UNITED KINGDOM,N
8,9,1st,"Appleton, Mrs Edward Dale (Charlotte Lamson)",58,Southampton,"Bayside, Queens, NY",C-101,,2,female,Y,SANTA MONICA,UNITED STATES,Y
9,10,1st,"Artagaveytia, Mr Ramon",71,Cherbourg,"Montevideo, Uruguay",,,-22,male,N,LONDON,UNITED KINGDOM,N
10,11,1st,"Astor, Colonel John Jacob",47,Cherbourg,"New York, NY",,17754 L224 10s 6d,-124,male,N,RIO DE JANEIRO,BRAZIL,N
11,12,1st,"Astor, Mrs John Jacob (Madeleine Talmadge Force)",19,Cherbourg,"New York, NY",,17754 L224 10s 6d,4,female,Y,CAPE TOWN,SOUTH AFRICA,Y
12,13,1st,"Aubert, Mrs Leontine Pauline",,Cherbourg,"Paris, France",B-35,17477 L69 6s,9,female,Y,EDINBURGH,SCOTLAND,Y
13,14,1st,"Barkworth, Mr Algernon H.",,Southampton,"Hessle, Yorks",A-23,,B,male,N,MONTREAL,CANADA,Y
14,15,1st,"Baumann, Mr John D.",,Southampton,"New York, NY",,,,male,N,VANCOUVER,BRITISH COLUMBIA,N
15,16,1st,"Baxter, Mrs James (Helene DeLaudeniere Chaput)",50,Cherbourg,"Montreal, PQ",B-58/60,,6,female,Y,RIO DE JANEIRO,BRAZIL,Y
16,17,1st,"Baxter, Mr Quigg Edmond",24,Cherbourg,"Montreal, PQ",B-58/60,,,male,N,MONTREAL,CANADA,N
17,18,1st,"Beattie, Mr Thomson",36,Cherbourg,"Winnipeg, MN",C-6,,,male,N,ISTANBUL,TURKEY,N
18,19,1st,"Beckwith, Mr Richard Leonard",37,Southampton,"New York, NY",D-35,,5,male,Y,ISTANBUL,TURKEY,Y
19,20,1st,"Beckwith, Mrs Richard Leonard (Sallie Monypeny)",47,Southampton,"New York, NY",D-35,,5,female,N,VANCOUVER,BRITISH COLUMBIA,Y
20,21,1st,"Behr, Mr Karl Howell",26,Cherbourg,"New York, NY",C-148,,5,male,N,HONOLULU,HAWAII,Y
21,22,1st,"Birnbaum, Mr Jakob",25,Cherbourg,"San Francisco, CA",,,-148,male,Y,HONG KONG,CHINA,N
22,23,1st,"Bishop, Mr Dickinson H.",25,Cherbourg,"Dowagiac, MI",B-49,,7,male,Y,TEL AVIV,ISRAEL,Y
23,24,1st,"Bishop, Mrs Dickinson H. (Helen Walton)",19,Cherbourg,"Dowagiac, MI",B-49,,7,female,Y,RIO DE JANEIRO,BRAZIL,Y
24,25,1st,"Bjornstrm-Steffansson, Mr Mauritz Hakan",28,Southampton,"Stockholm, Sweden / Washington, DC",,,D,male,N,RIO DE JANEIRO,BRAZIL,Y
25,26,1st,"Blackwell, Mr Stephen Weart",45,Southampton,"Trenton, NJ",,,-241,male,N,BEIJING,CHINA,N
26,27,1st,"Blank, Mr Henry",39,Cherbourg,"Glen Ridge, NJ",A-31,,7,male,Y,CAPE TOWN,SOUTH AFRICA,Y
27,28,1st,"Bonnell, Miss Caroline",30,Southampton,"Youngstown, OH",C-7,,8,female,N,KUALA LUMPUR,MALAYSIA,Y
28,29,1st,"Bonnell, Miss Elizabeth",58,Southampton,"Birkdale, England Cleveland, Ohio",C-103,,8,female,N,NEW YORK,UNITED STATES,Y
29,30,1st,"Borebank, Mr John James",,Southampton,"London / Winnipeg, MB",D-21/2,,,male,N,LONDON,UNITED KINGDOM,N
30,31,1st,"Bowen, Miss Grace Scott",45,Cherbourg,"Cooperstown, NY",,,4,female,Y,SYDNEY,AUSTRALIA,Y
31,32,1st,"Bowerman, Miss Elsie Edith",22,Southampton,"St Leonards-on-Sea, England Ohio",,,6,female,N,,,Y
32,33,1st,"Bradley, Mr George",,Southampton,"Los Angeles, CA",,,15,male,N,BARCELONA,SPAIN,Y
33,34,1st,"Brady, Mr John Bertram",41,Southampton,"Pomeroy, WA",,,,male,N,BEIJING,CHINA,N
34,35,1st,"Brandeis, Mr Emil",48,Cherbourg,"Omaha, NE",,17591 L50 9s 11d,-208,male,N,CHICAGO,UNITED STATES,N
35,36,1st,"Brewe, Dr Arthur Jackson",,Cherbourg,"Philadelphia, PA",,,,male,Y,KUALA LUMPUR,MALAYSIA,N
36,37,1st,"Brown, Mrs James Joseph (Margaret Molly"" Tobin)""",44,Cherbourg,"Denver, CO",,17610 L27 15s 5d,6,female,N,CHICAGO,UNITED STATES,Y
37,38,1st,"Brown, Mrs John Murray (Caroline Lane Lamson)",59,Southampton,"Belmont, MA",C-101,,D,female,Y,RIO DE JANEIRO,BRAZIL,Y
38,39,1st,"Bucknell, Mrs William Robert (Emma Eliza Ward)",60,Cherbourg,"Philadelphia, PA",,,8,female,Y,ISTANBUL,TURKEY,Y
39,40,1st,"Butt, Major Archibald Willingham",45,Southampton,"Washington, DC",,,,male,N,,,N
40,41,1st,"Calderhead, Mr Edward P.",,Southampton,"New York, NY",,,07-May,male,N,,,Y
41,42,1st,"Candee, Mrs Edward (Helen Churchill Hungerford)",53,Cherbourg,"Washington, DC",,,6,female,Y,MIAMI BEACH,FLORIDA,Y
42,43,1st,"Cardeza, Mrs James Warburton Martinez (Charlotte Wardle Drake)",58,Cherbourg,"Germantown, Philadelphia, PA",B-51/3/5,17755 L512 6s,3,female,Y,HONOLULU,HAWAII,Y
43,44,1st,"Cardeza, Mr Thomas Drake Martinez",36,Cherbourg,"Austria-Hungary / Germantown, Philadelphia, PA",B-51/3/5,17755 L512 6s,3,male,N,MIAMI BEACH,FLORIDA,Y
44,45,1st,"Carlsson, Mr Frans Olof",33,Southampton,"New York, NY",,,,male,Y,,,N
45,46,1st,"Carrau, Mr Francisco M.",,Southampton,"Montevideo, Uruguay",,,,male,Y,TEL AVIV,ISRAEL,N
46,47,1st,"Carrau, Mr Jose Pedro",,Southampton,"Montevideo, Uruguay",,,,male,Y,KUALA LUMPUR,MALAYSIA,N
47,48,1st,"Carter, Mr William Ernest",36,Southampton,"Bryn Mawr, PA",,,C,male,Y,HONOLULU,HAWAII,Y
48,49,1st,"Carter, Mrs William Ernest (Lucile Polk)",36,Southampton,"Bryn Mawr, PA",,,4,female,Y,MIAMI BEACH,FLORIDA,Y
49,50,1st,"Carter, Miss Lucile Polk",14,Southampton,"Bryn Mawr, PA",,,4,female,N,HONOLULU,HAWAII,Y
50,51,1st,"Carter, Master William T. II",11,Southampton,"Bryn Mawr, PA",,,4,male,Y,SANTA MONICA,UNITED STATES,Y
51,52,1st,"Case, Mr Howard Brown",49,Southampton,"Ascot, Berkshire / Rochester, NY",,,,male,N,KUALA LUMPUR,MALAYSIA,N
52,53,1st,"Cassebeer, Mrs Henry Arthur jr (Genevieve Fosdick)",,Cherbourg,"New York, NY",,,5,female,Y,RIO DE JANEIRO,BRAZIL,Y
53,54,1st,"Cavendish, Mr Tyrell William",36,Southampton,"Little Onn Hall, Staffs",,,-172,male,N,MONTREAL,CANADA,N
54,55,1st,"Cavendish, Mrs Tyrell William Julia Florence Siegel",,Southampton,"Little Onn Hall, Staffs",,,6,female,Y,SANTA MONICA,UNITED STATES,Y
55,56,1st,"Chaffee, Mr Herbert Fuller",46,Southampton,"Amenia, ND",,,,male,N,RIO DE JANEIRO,BRAZIL,N
56,57,1st,"Chaffee, Mrs Herbert Fuller (Carrie Constance Toogood)",47,Southampton,"Amenia, ND",,,,female,N,BEIJING,CHINA,Y
57,58,1st,"Chambers, Mr Norman Campbell",27,Southampton,"New York, NY / Ithaca, NY",,,5,male,Y,BARCELONA,SPAIN,Y
58,59,1st,"Chambers, Mrs Norman Campbell (Bertha Griggs)",31,Southampton,"New York, NY / Ithaca, NY",,,5,female,Y,CHICAGO,UNITED STATES,Y
59,60,1st,"Cherry, Miss Gladys",,Southampton,"London, England",,,8,female,N,NICE,FRANCE,Y
60,61,1st,"Chevre, Mr Paul",,Cherbourg,"Paris, France",,,7,male,N,,,Y
61,62,1st,"Chibnall (Bowerman), Mrs Edith Martha",,Southampton,"St Leonards-on-Sea, England Ohio",,,6,female,N,EDINBURGH,SCOTLAND,Y
62,63,1st,"Chisholm, Mr Roderick Robert",,,"Liverpool, England / Belfast",,,,male,N,,,N
63,64,1st,"Clark, Mr Walter Miller",27,Cherbourg,"Los Angeles, CA",C-87,,,male,N,CAPE TOWN,SOUTH AFRICA,N
64,65,1st,"Clark, Mrs Walter Miller (Virginia McDowell)",26,Cherbourg,"Los Angeles, CA",C-87,,4,female,Y,EDINBURGH,SCOTLAND,Y
65,66,1st,"Clifford, Mr George Quincy",,Southampton,"Stoughton, MA",,,,male,N,VANCOUVER,BRITISH COLUMBIA,N
66,67,1st,"Colley, Mr Edward Pomeroy",,Southampton,"Victoria, BC",,,,male,N,HONG KONG,CHINA,N
67,68,1st,"Compton, Mrs Alexander Taylor (Mary Eliza Ingersoll)",64,Cherbourg,"Lakewood, NJ",,,14,female,Y,,,Y
68,69,1st,"Compton, Mr Alexander Taylor, Jr",37,Cherbourg,"Lakewood, NJ",,,,male,N,NEW YORK,UNITED STATES,N
69,70,1st,"Compton, Miss Sara Rebecca",39,Cherbourg,"Lakewood, NJ",,,14,female,Y,,,Y
70,71,1st,"Cornell, Mrs Robert Clifford (Malvina Helen Lamson)",55,Southampton,"New York, NY",C-101,,2,female,Y,LONDON,UNITED KINGDOM,Y
71,72,1st,"Crafton, Mr John Bertram",,Southampton,"Roachdale, IN",,,,male,N,ISTANBUL,TURKEY,N
72,73,1st,"Crosby, Captain Edward Gifford",70,Southampton,"Milwaukee, WI",,,-269,male,Y,HONOLULU,HAWAII,N
73,74,1st,"Crosby, Mrs Edward Gifford (Catherine Elizabeth Halstead)",69,Southampton,"Milwaukee, WI",,,5,female,N,KUALA LUMPUR,MALAYSIA,Y
74,75,1st,"Crosby, Miss Harriet R.",36,Southampton,"Milwaukee, WI",,,5,female,N,TEL AVIV,ISRAEL,Y
75,76,1st,"Cumings, Mr John Bradley",39,Cherbourg,"New York, NY",C-85,,,male,N,MONTREAL,CANADA,N
76,77,1st,"Cumings, Mrs John Bradley (Florence Briggs Thayer)",38,Cherbourg,"New York, NY",C-85,,4,female,N,SANTA MONICA,UNITED STATES,Y
77,78,1st,"Daly, Mr Peter Denis ",,Southampton,"Lima, Peru",,,A,male,N,CAPE TOWN,SOUTH AFRICA,Y
78,79,1st,"Daniel, Mr Robert Williams",27,Southampton,"Philadelphia, PA",,,7,male,Y,CAPE TOWN,SOUTH AFRICA,Y
79,80,1st,"Davidson, Mr Thornton",31,Southampton,"Montreal, PQ",,,,male,Y,ISTANBUL,TURKEY,N
80,81,1st,"Davidson, Mrs Thornton (Orian Hays)",27,Southampton,"Montreal, PQ",,,3,female,N,MIAMI BEACH,FLORIDA,Y
81,82,1st,"de Villiers, Madame Berthe",,Cherbourg,"Belgium  Montreal, PQ",,,6,female,N,NICE,FRANCE,Y
82,83,1st,"Dick, Mr Albert Adrian",31,Cherbourg,"Calgary, AB",,,3,male,Y,VANCOUVER,BRITISH COLUMBIA,Y
83,84,1st,"Dick, Mrs Albert Adrian Vera Gillespie",17,Cherbourg,"Calgary, AB",,,3,female,Y,VANCOUVER,BRITISH COLUMBIA,Y
84,85,1st,"Dodge, Dr. Washington",,Southampton,"San Francisco, CA",,,13,male,Y,,,Y
85,86,1st,"Dodge, Mrs Washington (Ruth Vidaver)",,Southampton,"San Francisco, CA",,,07-May,female,N,NICE,FRANCE,Y
86,87,1st,"Dodge, Master Washington",4,Southampton,"San Francisco, CA",,,07-May,male,Y,VANCOUVER,BRITISH COLUMBIA,Y
87,88,1st,"Douglas, Mrs Frederick Charles (Suzette Baxter)",27,Cherbourg,"Montreal, PQ",,,6,female,Y,VANCOUVER,BRITISH COLUMBIA,Y
88,89,1st,"Douglas, Mr Walter Donald",50,Cherbourg,"Deephaven, MN / Cedar Rapids, IA",,,-62,male,N,BEIJING,CHINA,N
89,90,1st,"Douglas, Mrs Walter Donald (Mahala Dutton)",48,Cherbourg,"Deephaven, MN / Cedar Rapids, IA",,,2,female,N,MONTREAL,CANADA,Y
90,91,1st,"Duff Gordon, Sir Cosmo Edmund",49,Cherbourg,London / Paris,,11755 L39 12s,1,male,Y,RIO DE JANEIRO,BRAZIL,Y
91,92,1st,"Duff Gordon, Lady (Lucille Wallace Sutherland)",48,Cherbourg,London / Paris,,17485 L56 18s 7d,1,female,Y,KUALA LUMPUR,MALAYSIA,Y
92,93,1st,"Dulles, Mr William Crothers",39,Cherbourg,"Philadelphia, PA",,,-133,male,Y,EDINBURGH,SCOTLAND,N
93,94,1st,"Earnshaw, Mrs Boulton (Olive Potter)",23,Cherbourg,"Mt Airy, Philadelphia, PA",,,7,female,Y,VANCOUVER,BRITISH COLUMBIA,Y
94,95,1st,"Eustis, Miss Elizabeth Mussey",53,Cherbourg,"Brookline, MA",,,4,female,N,,,Y
95,96,1st,"Evans, Miss Edith Corse",36,Cherbourg,"New York, NY",,,,female,N,,,N
96,97,1st,"Flegenheim, Mrs Alfred (Antoinette)",,Cherbourg,"New York, NY",,,7,female,N,SANTA MONICA,UNITED STATES,Y
97,98,1st,"Flynn, Mr John Irving",,Southampton,"Brooklyn, NY",,,07-May,male,Y,,,Y
98,99,1st,"Foreman, Mr Benjamin Laventall",30,Cherbourg,"New York, NY",,,,male,N,EDINBURGH,SCOTLAND,N
99,100,1st,"Fortune, Miss Alice Elizabeth",24,Southampton,"Winnipeg, MB",,,10,female,Y,VANCOUVER,BRITISH COLUMBIA,Y
100,101,1st,"Fortune, Mr Charles Alexander",19,Southampton,"Winnipeg, MB",,,,male,N,MONTREAL,CANADA,N
101,102,1st,"Fortune, Miss Ethel Flora",28,Southampton,"Winnipeg, MB",,,10,female,Y,SANTA MONICA,UNITED STATES,Y
102,103,1st,"Fortune, Miss Mabel",23,Southampton,"Winnipeg, MB",,,10,female,N,CHICAGO,UNITED STATES,Y
103,104,1st,"Fortune, Mr Mark",64,Southampton,"Winnipeg, MB",,,,male,N,KUALA LUMPUR,MALAYSIA,N
104,105,1st,"Fortune, Mrs Mark (Mary McDougald)",60,Southampton,"Winnipeg, MB",,,10,female,Y,RIO DE JANEIRO,BRAZIL,Y
105,106,1st,"Franklin, Mr Thomas Parham",,Southampton,"Westcliff-on-Sea, Essex",,,,male,N,SYDNEY,AUSTRALIA,N
106,107,1st,"Frauenthal, Dr Henry William",49,Cherbourg,"New York, NY",,,5,male,Y,ISTANBUL,TURKEY,Y
107,108,1st,"Frauenthal, Mrs Henry William (Clara Heinsheimer)",,Cherbourg,"New York, NY",,,5,female,Y,HONG KONG,CHINA,Y
108,109,1st,"Frauenthal, Mr Isaac Gerald",44,Southampton,"New York, NY",,,5,male,N,EDINBURGH,SCOTLAND,Y
109,110,1st,"Frolicher, Miss Marguerite",22,Cherbourg,"Zurich, Switzerland",,,5,female,N,MIAMI BEACH,FLORIDA,Y
110,111,1st,"Frolicher-Stehli, Mr Maxmillian",60,Cherbourg,"Zurich, Switzerland",,,5,male,Y,RIO DE JANEIRO,BRAZIL,Y
111,112,1st,"Frolicher-Stehli, Mrs Maxmillian (Margaretha Emerentia Stehli)",48,Cherbourg,"Zurich, Switzerland",,,5,female,Y,SYDNEY,AUSTRALIA,Y
112,113,1st,"Futrelle, Mr Jacques",37,Southampton,"Scituate, MA",,,,male,N,CHICAGO,UNITED STATES,N
113,114,1st,"Futrelle, Mrs Jacques (May Peel)",35,Southampton,"Scituate, MA",,,9,female,N,VANCOUVER,BRITISH COLUMBIA,Y
114,115,1st,"Gee, Mr Arthur H.",47,Southampton,"St Anne's-on-Sea, Lancashire",,,-275,male,Y,ISTANBUL,TURKEY,N
115,116,1st,"Gibson, Miss Dorothy",22,Cherbourg,"New York, NY",,,7,female,N,SANTA MONICA,UNITED STATES,Y
116,117,1st,"Gibson, Mrs Leonard (Pauline C. Boeson)",45,Cherbourg,"New York, NY",,,7,female,N,BEIJING,CHINA,Y
117,118,1st,"Goldenberg, Mr Samuel L.",49,Cherbourg,"Paris, France / New York, NY",,,5,male,N,EDINBURGH,SCOTLAND,Y
118,119,1st,"Goldenberg, Mrs Samuel L. (Edwiga Grabowsko)",,Cherbourg,"Paris, France / New York, NY",,,5,female,N,SYDNEY,AUSTRALIA,Y
119,120,1st,"Goldschmidt, Mr George B.",71,Cherbourg,"New York, NY",,,,male,N,NEW YORK,UNITED STATES,N
120,121,1st,"Gracie, Colonel Archibald IV",54,Southampton,"Washington, DC",C-51,113780 L28 10s,B,male,N,,,Y
121,122,1st,"Graham, Mr George Edward",38,Southampton,"Winnipeg, MB",,,-147,male,N,,,N
122,123,1st,"Graham, Miss Margaret Edith",19,Southampton,"Greenwich, CT",C-125,17582 L153 9s 3d,3,female,N,BEIJING,CHINA,Y
123,124,1st,"Graham, Mrs William Thompson (Edith Junkins)",58,Southampton,"Greenwich, CT",C-91,17582 L153 9s 3d,3,female,N,KUALA LUMPUR,MALAYSIA,Y
124,125,1st,"Greenfield, Mrs Leo David (Blanche Strouse)",45,Cherbourg,"New York, NY",,,7,female,Y,EDINBURGH,SCOTLAND,Y
125,126,1st,"Greenfield, Mr William Bertram",23,Cherbourg,"New York, NY",,,7,male,Y,KUALA LUMPUR,MALAYSIA,Y
126,127,1st,"Guggenheim, Mr Benjamin",46,Cherbourg,"New York, NY",B-82/4,17593 L56 18s 7d,,male,N,CAPE TOWN,SOUTH AFRICA,N
127,128,1st,"Harder, Mr George Achilles",25,Cherbourg,"Brooklyn, NY",,,5,male,Y,TEL AVIV,ISRAEL,Y
128,129,1st,"Harder, Mrs George Achilles (Dorothy Annan)",21,Cherbourg,"Brooklyn, NY",,,5,female,N,VANCOUVER,BRITISH COLUMBIA,Y
129,130,1st,"Harper, Mr Henry Sleeper",48,Cherbourg,"New York, NY",,,3,male,Y,,,Y
130,131,1st,"Harper, Mrs Henry Sleeper (Myna Haxtun)",49,Cherbourg,"New York, NY",,,3,female,N,CAPE TOWN,SOUTH AFRICA,Y
131,132,1st,"Harris, Mr Henry Birkhardt",45,Southampton,"New York, NY",C-83,36973 L83 9s 6d,,male,N,,,N
132,133,1st,"Harris, Mrs Henry Birkhardt (Irene Wallach)",36,Southampton,"New York, NY",C-83,36973 L83 9s 6d,D,female,N,NICE,FRANCE,Y
133,134,1st,"Hawksford, Mr Walter James",,Southampton,"Kingston, Surrey",,,3,male,Y,EDINBURGH,SCOTLAND,Y
134,135,1st,"Hays, Mr Charles Melville",55,Southampton,"Montreal, PQ",,,-307,male,N,,,N
135,136,1st,"Hays, Mrs Charles Melville (Clara Jennings Gregg)",52,Southampton,"Montreal, PQ",,,3,female,Y,,,Y
136,137,1st,"Hays, Miss Margaret Bechstein",24,Southampton,"New York, NY",,,7,female,N,,,Y
137,138,1st,"Head, Mr Christopher",,Southampton,London / Middlesex,,,,male,N,NICE,FRANCE,N
138,139,1st,"Hilliard, Mr Herbert Henry",,Southampton,"Brighton, MA",,,,male,Y,LONDON,UNITED KINGDOM,N
139,140,1st,"Hipkins, Mr William Edward",,Southampton,London / Birmingham,,,,male,Y,LONDON,UNITED KINGDOM,N
140,141,1st,"Hippach, Miss Jean Gertrude",16,Cherbourg,"Chicago, IL",B-18,111361 L57 19s 7d,4,female,Y,,,Y
141,142,1st,"Hippach, Mrs Louis Albert (Ida Sophia Fischer)",44,Cherbourg,"Chicago, IL",B-18,111361 L57 19s 7d,4,female,N,HONG KONG,CHINA,Y
142,143,1st,"Hogeboom, Mrs John C. (Anna Andrews)",51,Southampton,"Hudson, NY",D-?,13502 L77,10,female,Y,TEL AVIV,ISRAEL,Y
143,144,1st,"Holverson, Mr Alexander Oskar",42,Southampton,"New York, NY",,,-38,male,N,,,N
144,145,1st,"Holverson, Mrs Alexander Oskar (Mary Aline Towner)",35,Southampton,"New York, NY",,,,female,N,BARCELONA,SPAIN,Y
145,146,1st,"Homer, Mr Harry",35,Cherbourg,"Indianapolis, IN",,,15,male,Y,VANCOUVER,BRITISH COLUMBIA,Y
146,147,1st,"Hoyt, Mr Frederick Maxfield",38,Southampton,"New York, NY /  Stamford CT",C-93,,D,male,Y,RIO DE JANEIRO,BRAZIL,Y
147,148,1st,"Hoyt, Mrs Frederick Maxfield (Jane Anne Forby)",35,Southampton,"New York, NY /  Stamford CT",C-93,,D,female,Y,EDINBURGH,SCOTLAND,Y
148,149,1st,"Hoyt, Mr William F.",,Cherbourg,"New York, NY",,,14,male,Y,,,N
149,150,1st,"Isham, Miss Anne Elizabeth",50,Cherbourg,"Paris, France New York, NY",C-49,,,female,Y,HONG KONG,CHINA,N
150,151,1st,"Ismay, Mr Joseph Bruce",49,Southampton,Liverpool,B-52/4/6,112058 Complimentary,C,male,N,SANTA MONICA,UNITED STATES,Y
151,152,1st,"Jones, Mr Charles Cresson",46,Southampton,"Bennington, VT",,,-80,male,N,KUALA LUMPUR,MALAYSIA,N
152,153,1st,"Julian, Mr Henry Forbes",,Southampton,London,,,,male,N,KUALA LUMPUR,MALAYSIA,N
153,154,1st,"Kent, Mr Edward Austin",58,Cherbourg,"Buffalo, NY",,,-258,male,N,CHICAGO,UNITED STATES,N
154,155,1st,"Kenyon, Mr Frederick R.",41,Southampton,"Southington / Noank, CT",,,,male,Y,BEIJING,CHINA,N
155,156,1st,"Kenyon, Mrs Frederick R. (Marion)",,Southampton,"Southington / Noank, CT",,,8,female,Y,,,Y
156,157,1st,"Kimball, Mr Edwin Nelson Jr.",42,Southampton,"Boston, MA",,,5,male,N,TEL AVIV,ISRAEL,Y
157,158,1st,"Kimball, Mrs Edwin Nelson Jr. (Gertrude Parsons)",40,Southampton,"Boston, MA",,,5,female,Y,CAPE TOWN,SOUTH AFRICA,Y
158,159,1st,"Klaber, Mr Herman",,Southampton,"Portland, OR",,,,male,N,,,N
159,160,1st,"Leader, Dr Alice Farnham",,Southampton,"New York, NY",,,8,female,N,HONOLULU,HAWAII,Y
160,161,1st,"Lewy, Mr Ervin G.",,Cherbourg,"Chicago, IL",,,,male,Y,ISTANBUL,TURKEY,N
161,162,1st,"Lindeberg-Lind, Mr Erik Gustaf",42,Southampton,"Stockholm, Sweden",,,,male,N,ISTANBUL,TURKEY,N
162,163,1st,"Lindstrom, Mrs Carl Johan (Sigrid Posse)",55,Cherbourg,"Stockholm, Sweden",,,6,female,N,SANTA MONICA,UNITED STATES,Y
163,164,1st,"Lines, Mrs Ernest H. (Elizabeth Lindsey James)",50,Cherbourg,"Paris, France",,,9,female,Y,VANCOUVER,BRITISH COLUMBIA,Y
164,165,1st,"Lines, Miss Mary Conover",16,Cherbourg,"Paris, France",,,9,female,N,NICE,FRANCE,Y
165,166,1st,"Lingrey, Mr Edward",,,,,,,male,N,EDINBURGH,SCOTLAND,N
166,167,1st,"Long, Mr Milton Clyde",29,Southampton,"Springfield, MA",,,-126,male,N,,,N
167,168,1st,"Longley, Miss Gretchen Fiske",21,Southampton,"Hudson, NY",D-?,13502 L77,10,female,Y,,,Y
168,169,1st,"Loring, Mr Joseph Holland",30,Southampton,"London / New York, NY",,,,male,Y,,,N
169,170,1st,"Madill, Miss Georgette Alexandra",15,Southampton,"St Louis, MO",B-5,24160 L221,2,female,N,SANTA MONICA,UNITED STATES,Y
170,171,1st,"Maguire, Mr John Edward",30,Southampton,"Brockton, MA",,,,male,Y,KUALA LUMPUR,MALAYSIA,N
171,172,1st,"Marechal, Mr Pierre",,Cherbourg,"Paris, France",,,7,male,Y,SANTA MONICA,UNITED STATES,Y
172,173,1st,"Marvin, Mr Daniel Warner",,Southampton,"New York, NY",,,,male,Y,KUALA LUMPUR,MALAYSIA,N
173,174,1st,"Marvin, Mrs Daniel Warner (Mary Graham Carmichael Farquarson)",,Southampton,"New York, NY",,,,female,Y,SANTA MONICA,UNITED STATES,Y
174,175,1st,"McCaffry, Mr Thomas Francis",46,Cherbourg,"Vancouver, BC",,,-292,male,Y,CHICAGO,UNITED STATES,N
175,176,1st,"McCarthy, Mr Timothy J.",54,Southampton,"Dorchester, MA",,,-175,male,Y,TEL AVIV,ISRAEL,N
176,177,1st,"McGough, Mr James R.",36,Southampton,"Philadelphia, PA",,,7,male,Y,SYDNEY,AUSTRALIA,Y
177,178,1st,"Meyer, Mr Edgar Joseph",28,Cherbourg,"New York, NY",,,,male,N,EDINBURGH,SCOTLAND,N
178,179,1st,"Meyer, Mrs Edgar Joseph (Leila Saks)",,Cherbourg,"New York, NY",,,6,female,N,,,Y
179,180,1st,"Millet, Mr Francis Davis",65,Southampton,"East Bridgewater, MA",,,-249,male,N,CHICAGO,UNITED STATES,N
180,181,1st,"Minahan, Miss Daisy E.",33,Queenstown,"Green Bay, WI",,,14,female,Y,HONG KONG,CHINA,Y
181,182,1st,"Minahan, Dr William Edward",44,Queenstown,"Fond du Lac, WI",,,-230,male,N,,,N
182,183,1st,"Minahan, Mrs William Edward (Lillian E. Thorpe)",37,Queenstown,"Fond du Lac, WI",,,14,female,Y,TEL AVIV,ISRAEL,Y
183,184,1st,"Mock, Mr Philip E.",,Cherbourg,"New York, NY",,,11,male,N,NEW YORK,UNITED STATES,Y
184,185,1st,"Molson, Mr Harry Markland",55,Southampton,"Montreal, PQ",,,,male,Y,KUALA LUMPUR,MALAYSIA,N
185,186,1st,"Moore, Mr Clarence Bloomfield",47,Southampton,"Washington, DC",,,,male,N,KUALA LUMPUR,MALAYSIA,N
186,187,1st,"Natsch, Mr Charles H.",36,Cherbourg,"Brooklyn, NY",,,,male,N,ISTANBUL,TURKEY,N
187,188,1st,"Newell, Mr Arthur Webster",58,Cherbourg,"Lexington, MA",,,-122,male,N,CHICAGO,UNITED STATES,N
188,189,1st,"Newell, Miss Madeleine",31,Cherbourg,"Lexington, MA",,,6,female,N,HONOLULU,HAWAII,Y
189,190,1st,"Newell, Miss Marjorie",23,Cherbourg,"Lexington, MA",,,6,female,N,BARCELONA,SPAIN,Y
190,191,1st,"Newsom, Miss Helen Monypeny",19,Southampton,"New York, NY",,,5,female,Y,NICE,FRANCE,Y
191,192,1st,"Nicholson, Mr Arthur Ernest",64,Southampton,"Isle of Wight, England",,,-263,male,Y,RIO DE JANEIRO,BRAZIL,N
192,193,1st,"Omont, Mr A. Fernand",,Cherbourg,"Paris, France",,,7,male,Y,NEW YORK,UNITED STATES,Y
193,194,1st,"Ostby, Mr Engelhart Cornelius",64,Cherbourg,"Providence, RI",,,-234,male,Y,EDINBURGH,SCOTLAND,N
194,195,1st,"Ostby, Miss Helen Raghnild",22,Cherbourg,"Providence, RI",,,5,female,Y,CAPE TOWN,SOUTH AFRICA,Y
195,196,1st,"Ovies y Rodriguez, Mr Servando",28,,"?Havana, Cuba",,,-189,male,N,KUALA LUMPUR,MALAYSIA,N
196,197,1st,"Parr, Mr William Henry Marsh",,,Belfast,,,,male,Y,CHICAGO,UNITED STATES,N
197,198,1st,"Partner, Mr Austin",,Southampton,"Surbiton Hill, Surrey",,,-166,male,Y,KUALA LUMPUR,MALAYSIA,N
198,199,1st,"Payne, Mr Vivian Ponsonby",22,Southampton,"Montreal, PQ",,,,male,N,KUALA LUMPUR,MALAYSIA,N
199,200,1st,"Pears, Mr Thomas",,Southampton,"Isleworth, England",,,,male,N,HONOLULU,HAWAII,N
200,201,1st,"Pears, Mrs Thomas (Edith)",,Southampton,"Isleworth, England",,,8,female,Y,SYDNEY,AUSTRALIA,Y
201,202,1st,"Penasco, Mr Victor de Satode",18,Cherbourg,"Madrid, Spain",,,,male,N,VANCOUVER,BRITISH COLUMBIA,N
202,203,1st,"Penasco, Mrs Victor de Satode (Josefa de Soto)",17,Cherbourg,"Madrid, Spain",,,8,female,Y,MONTREAL,CANADA,Y
203,204,1st,"Peuchen, Major Arthur Godfrey",52,Southampton,"Toronto, ON",C-104,,6,male,N,SANTA MONICA,UNITED STATES,Y
204,205,1st,"Porter, Mr Walter Chamberlain",46,Southampton,"Worcester, MA",,,-207,male,Y,HONG KONG,CHINA,N
205,206,1st,"Potter, Mrs Thomas, Jr. (Lily Alexenia Wilson)",56,Cherbourg,"Mt Airy, Philadelphia, PA",,,7,female,Y,BARCELONA,SPAIN,Y
206,207,1st,"Reuchlin, Jonkheer John George",,Southampton,"Rotterdam, Netherlands",,,,male,N,ISTANBUL,TURKEY,N
207,208,1st,"Rheims, Mr George Lucien",,Cherbourg,"Paris /  New York, NY",,17604 L39 12s,A,male,N,EDINBURGH,SCOTLAND,Y
208,209,1st,"Robert, Mrs Edward Scott (Elisabeth Walton McMillan)",43,Southampton,"St Louis, MO",B-3,24160 L221,2,female,N,NICE,FRANCE,Y
209,210,1st,"Roebling, Mr Washington Augustus 2nd",31,Southampton,"Trenton, NJ",,,,male,N,RIO DE JANEIRO,BRAZIL,N
210,211,1st,"Romaine, Mr Charles Hallace",,Southampton,"New York, NY",,,15,male,N,RIO DE JANEIRO,BRAZIL,Y
211,212,1st,"Rood, Mr Hugh R.",,Southampton,"Seattle, WA",,,,male,N,HONOLULU,HAWAII,N
212,213,1st,"Rosenbaum (Russell), Miss Edith Louise",33,Cherbourg,"Paris, France",A-11,17613 L27 14s 5d,11,female,Y,VANCOUVER,BRITISH COLUMBIA,Y
213,214,1st,"Ross, Mr John Hugo",,Cherbourg,"Winnipeg, MB",,,,male,N,,,N
214,215,1st,"Rothes, the Countess of (Noel Lucy Martha Dyer-Edwardes)",27,Southampton,"London  Vancouver, BC",,,8,female,N,TEL AVIV,ISRAEL,Y
215,216,1st,"Rothschild, Mr Martin",55,Cherbourg,"New York, NY",,,,male,N,CHICAGO,UNITED STATES,N
216,217,1st,"Rothschild, Mrs Martin (Elizabeth L. Barrett)",54,Cherbourg,"New York, NY",,,6,female,N,MIAMI BEACH,FLORIDA,Y
217,218,1st,"Rowe, Mr Alfred G.",,Southampton,London,,,-109,male,N,ISTANBUL,TURKEY,N
218,219,1st,"Ryerson, Mr Arthur Larned",61,Cherbourg,"Haverford, PA / Cooperstown, NY",,17608 L262 7s 6d,,male,N,BEIJING,CHINA,N
219,220,1st,"Ryerson, Mrs Arthur Larned (Emily Maria Borie)",48,Cherbourg,"Haverford, PA / Cooperstown, NY",,17608 L262 7s 6d,4,female,N,MIAMI BEACH,FLORIDA,Y
220,221,1st,"Ryerson, Miss Emily Borie",18,Cherbourg,"Haverford, PA / Cooperstown, NY",,17608 L262 7s 6d,4,female,Y,SYDNEY,AUSTRALIA,Y
221,222,1st,"Ryerson, Master John Borie",13,Cherbourg,"Haverford, PA / Cooperstown, NY",,17608 L262 7s 6d,4,male,Y,,,Y
222,223,1st,"Ryerson, Miss Susan (Suzette) Parker",21,Cherbourg,"Haverford, PA / Cooperstown, NY",,17608 L262 7s 6d,4,female,Y,CAPE TOWN,SOUTH AFRICA,Y
223,224,1st,"Saalfeld, Mr Adolphe",,Southampton,"Manchester, England",,,3,male,Y,TEL AVIV,ISRAEL,Y
224,225,1st,"Salomon, Mr Abraham L.",,Southampton,"New York, NY",,,1,male,Y,SYDNEY,AUSTRALIA,Y
225,226,1st,"Schabert, Mrs Paul (Emma Mock)",,Cherbourg,"New York, NY",,,11,female,Y,HONG KONG,CHINA,Y
226,227,1st,"Seward, Mr Frederic Kimber",34,Southampton,"New York, NY",,,7,male,N,TEL AVIV,ISRAEL,Y
227,228,1st,"Shutes, Miss Elizabeth W.",40,Southampton,"New York, NY / Greenwich CT",C-125,17582 L153 9s 3d,3,female,N,,,Y
228,229,1st,"Silverthorne, Mr Spencer Victor",36,Southampton,"St Louis, MO",,,5,male,Y,MIAMI BEACH,FLORIDA,Y
229,230,1st,"Silvey, Mr William Baird",50,,"Duluth, MN",,,,male,Y,HONG KONG,CHINA,N
230,231,1st,"Silvey, Mrs William Baird (Alice Munger)",39,,"Duluth, MN",,,,female,Y,BARCELONA,SPAIN,Y
231,232,1st,"Simonius-Blumer, Col Alfons",56,,"Basel, Switzerland",,,3,male,N,LONDON,UNITED KINGDOM,Y
